"id","site","job_url","job_url_direct","title","company","location","job_type","date_posted","salary_source","interval","min_amount","max_amount","currency","is_remote","job_level","job_function","company_industry","listing_type","emails","description","company_url","company_url_direct","company_addresses","company_num_employees","company_revenue","company_description","logo_photo_url","banner_photo_url","ceo_name","ceo_photo_url"
"1188bedc37a1aecf","indeed","https://www.indeed.com/viewjob?jk=1188bedc37a1aecf","http://traitset.com/course/postingdetail.aspx?position=2090997&id=2775997&r=i","Bartender","","Stamford, CT, US","","2024-09-01","","","","","",False,"","","","","","**BUFFALO WILD WINGS – Bartender Description**

If you enjoy working in a fun, high-energy environment, we invite you to bring your enthusiasm and passion to **BUFFALO WILD WINGS** ! Come join a team that is all great food, family and friends! We are currently seeking **Bartenders** to join our team!


The Bartender blends equal parts enthusiasm, attention to detail, and knowledge of our extensive food and beverage options. We count on you to create a unique, personal experience for each Guest you encounter by making personal connections –Garnished with a great attitude that brings folks back to **BUFFALO WILD WINGS.**

**Knowledge and Skills:**

Knowledge of commonly ordered drinks and ability to make suggestions.
Knowledge of RAS (Responsible Alcohol Service) procedures as defined by both state laws and local guidelines.
Superior customer service and interpersonal skills to satisfy guest needs and solicit feedback.
Knowledge of proper sanitation, food safety, and security procedures.
Knowledge of current marketing initiatives and up-coming events in order to proactively inform Guests and invite them back.
Knowledge of food and beverage menus and ability to make suggestions to enhance guest experience and increase ticket sales.
Skill in time management and organization with excellent attention to detail.
Ability to take direction and execute team and company objectives.
Basic mathematical skills and ability to handle money accurately.
Basic knowledge of Point of Sale systems.
Conflict management and problem resolution skills.
Comply with all portion sizes, quality standards, and department rules, policies, and procedures.
Ability to follow specific service time and guidelines while engaging Guests and personalizing their experience.
Must be reliable and dependable by adhering to a schedule, covering shifts as necessary, and being on time for scheduled shifts.
Ability to maintain a high degree of pace and intensity for an extended period of time
WOW our Team Members by providing the same respect, positive encouragement, and fair treatment within the organization that we expect Team Members to share externally with every guest.
Work as a contributing member of a team and communication with management, kitchen staff, and serving staff to ensure effective customer flow.
Maintain positive working relationships with all Team Members and managers.
WOW our guests every day by achieving the highest level of satisfaction with an extraordinary focus on friendly service, food, fun, and value.  

**Education/Experience:**

**Required:** Minimum age of 21-year-old; Certification to serve alcohol as dictated by the State and local laws.


Prior bartending experience preferred  



**Job Benefits:**

Competitive pay


Flexible Hours


Extensive Training


Meal Discounts  



**Career Advancement Opportunities \\* Great Pay \\* Fun, Energetic Work Environment** 0


**BUFFALO WILD WINGS** ! **Apply Now to the Bartender Position!**","","","","","","","","","",""
"655d4d37ed6525ef","indeed","https://www.indeed.com/viewjob?jk=655d4d37ed6525ef","http://traitset.com/course/postingdetail.aspx?position=2106408&id=11303408&r=i","Security Officer - Brooklyn Army Terminal","Motivated Security Services","Somerville, NJ, US","parttime, fulltime","2024-09-01","","hourly","","","USD",False,"","","","","","**Motivated Security – Security Officer – Brooklyn Army Terminal**

Location: Brooklyn Army Terminal / Brooklyn Navy Terminal


License / Certification Requirements: NY Guard License, Driver License, and F01


Pay-Rate: $ 16.36 hourly, plus free medical benefits!


Fulltime / Part-Time Positions Available  



 **$2,500 Sign on Bonus!*** ***Bi-Weekly Pay!!!***
* ***Join the Union - Guaranteed PTO, Full Family Medical Insurance, and Pay Increases.***
* ***32BJ Employee Perks - SEIU Credit Card, Up to %50 Travel, Amusement Parks, Broadway Shows, and Many More!***

  

**Must have Driver License, NY Guard License, F-01 Fire Guard License to Start.**  


**Immediate Hire!!!!!**

This year, Motivated Security is celebrating 50 Years of accomplishments and a commitment to the multi-faceted security industry by providing our diverse list of customers with dependable, smart, and cost-effective security solutions. If you’re an honest, customer service oriented, hardworking, professional who always strives to do their best, we’re looking for you. We invite you to explore an opportunity with Motivated Security whether just starting your career or as an experienced security professional looking to join a rewarding team.


If you’re at least 18 years of age and have a valid Drivers' License; Social Security card, Passport, or other government ID; a High School diploma or equivalent; required NJ or NY State Guard License and reliable transportation, you can get started on a successful and rewarding career track with Motivated Security Services, Inc.


For our full-time associates, we offer medical, dental, and life insurance, 401K, PTO and holiday bonuses, family assistance programs, company and vendor discounts. Since over 70% of our promotions occur from within, you are almost assured advancement if you consistently exhibit Motivated’s core values, work hard, and help our brand grow.


Motivated also has part-time, flexible, and floating schedules available. If you’re ready to launch an illustrious career with Motivated, this is where you begin.  



**Ideal candidates must:**

Be customer service oriented.


Have the desire to interact with people positively and in support of Motivated’s core values.


Be able to obtain a State Guard License in New Jersey or New York dependent upon the state in which you work.


Have the ability to operate radio and telephone equipment, and console monitors


be able to read, understand, follow, and communicate standard operating procedures and instructions.


Have a flexible work schedule.


Have above average computer skills to utilize innovative technology and database platforms.


Agree to maintain our strict time and attendance standards.


Comply with Motivated’s appearance standards, and maintain a professional appearance at all times while wearing our uniform, insignia, and attire


be able to assess and evaluate situations effectively.


Have excellent verbal and written English communication skills.


How active listening skills.


Demonstrate a strong attention to detail.  



**Job responsibilities include:**

Displaying courtesy, respect and exceptional customer service to our customers, employees and visitors.


Overall responsibility of managing tenant and guest access to our client properties.


Performing a variety of safety, security, customer services, public relations duties, and related functions specific to the job location.


Providing the first line of response to emergencies and carrying out the policies and procedures of our customer’s Property Management.


Observing and reporting security issues and safety concerns as required.


Responding appropriately to fire command station signals and alarms.


Controlling access to our customer’s facility through admittance processes, and screening visitors and employees.


Monitoring entrances and exits, and acting to prevent unapproved or unauthorized entry.


Preparing logs or reports and other documents as required and/or requested.


Observing and reporting incidents or suspicious activity to customer representatives, Motivated Security management, life/safety personnel or public safety authorities as appropriate for the circumstances and/or as required by our customer.


Lifting or carrying up to 40 pounds.


Working in various environments including conditions such as rain, cold, or heat


maintaining a constant level of alertness and attention while working.  



Thank you for your interest in working with Motivated Security Services, Inc. We are an equal opportunity employer and we do not discriminate. We celebrate diversity and are committed to creating a safe environment for all Motivated associates. If you have questions regarding our hiring process, or believe you were treated unfairly, please contact the Human Resources department at 908-526-1140.  



**Join Motivated Security as a Security Officer – Brooklyn Army Terminal**

**Apply Today!**","https://www.indeed.com/cmp/Motivated-Security-Services","https://motivatedsecurity.com/","","501 to 1,000","$25M to $100M (USD)","","https://d2q79iu7y748jz.cloudfront.net/s/_squarelogo/256x256/a524a1c5b42b1f1c7cf8e6815e9b5d58","","",""
"6ed55bac22a4c813","indeed","https://www.indeed.com/viewjob?jk=6ed55bac22a4c813","http://traitset.com/course/postingdetail.aspx?position=2091163&id=23815163&r=i","Security Officer - Experienced Retail","","Brooklyn, NY, US","parttime, fulltime","2024-09-01","","hourly","","","USD",False,"","","","","","**Security Officer - Construction Site**

Narrow Security is a leading security solutions provider committed to ensuring the safety and security of our clients and their assets. We pride ourselves on delivering exceptional security services with a strong focus on professionalism, integrity, and customer satisfaction.


As we continue to grow, we are seeking a highly skilled and professional Security Guard with a background in Construction to join our dynamic team. The ideal candidate will play a crucial role in maintaining a safe and secure environment for our clients while providing excellent service.


**Responsibilities:**

* Provide a visible presence to deter unauthorized individuals and prevent security breaches.
* Greet and assist visitors, employees, and clients with a friendly and professional demeanor.
* Complete detailed incident reports and report any unusual incidents or suspicious activities.
* Handle conflicts or disturbances in a calm and professional manner
* Collaborate with local law enforcement when required and follow proper protocols.
* Provide exceptional customer service by addressing inquiries and resolving issues promptly.
* Maintain impeccable appearance/groomed in Narrow Security Uniform

**Qualifications:**

* Must have a Valid NYS Security Guard License.
* Must have OSHA 30
* Must have SST Card
* F04- Certification of Fitness from FDNY preferred
* Proven experience as a Security Guard with a background in construction
* Excellent communication and interpersonal skills.
* Detail-oriented and reliable.
* Strong observational and problem-solving abilities.
* Customer service training or experience is a definite plus.
* High school diploma or equivalent
* Must be physically fit and able to stand for extended periods.

**Benefits:**

* Competitive salary commensurate with experience.
* Health and dental insurance coverage.
* Retirement savings plan.
* Opportunities for professional development and advancement.
* Employee recognition programs.
Job Types: Full-time, Part-time


Salary: $24.00 per hour


Expected hours: 40 per week","","","","","","","","","",""
"6be6a5e5b311c0ee","indeed","https://www.indeed.com/viewjob?jk=6be6a5e5b311c0ee","http://traitset.com/course/postingdetail.aspx?position=2107307&id=28130307&r=i","Hourly Team Members","Dave’s Hot Chicken","Wayne, NJ, US","","2024-09-01","","","","","",False,"","","","","","The Team Member is responsible and accountable for performing specific tasks and duties assigned within the Restaurant including Guest Service, Food prep, Restaurant Cleanliness and Teamwork.
**Job Expectations:**The Team Member will work productively in a fast-paced environment, maintain a fast speed of service, interact with Guests, work closely with other Team Members to complete tasks, follow all safety and security procedures, and conduct other duties assigned by the Restaurant Management Team.
**Duties:**· Follow the steps outlined in the DHC Training Program to learn new skills, duties, and responsibilities
· Abide by the rules and direction given by the Restaurant Management Team and refrain from insubordination
· Communicate to their immediate supervisor when additional training guidance and practice is needed
· Understand how each job responsibility impacts Guests, the Team, and overall Restaurant Operations and success
· Greet Guests, record orders, and serve food and beverages with a consistently positive and helpful attitude, including answering questions
· Work together with other Teammates to prepare items on the DHC menu while following cooking instructions, safety procedures, and sanitary requirements
· Communicate effectively with Team Members and Management to resolve any interpersonal issues as needed
· Use specific kitchen machinery/equipment such as ice cream dispensers, fryers, warmers, etc.
· Ensure Restaurant cleanliness daily by clearing tables, sweeping, and mopping floors, washing/sanitizing/disinfecting kitchen utensils and high touch-point areas, and servicing restrooms
· Handle Guests' concerns and complaints professionally and calmly to resolve problems according to Restaurant Policy
· Maintain a neat and tidy appearance by wearing a uniform and adhering to the DHC Uniform Policy
· Follows all company guidelines for food and cash controls; follows all cost control guidelines to maintain and minimize Restaurant costs and effectively uses all products, supplies, and equipment facilities
· Are performance-oriented and performance driven; understand performance expectations and are aware of performance results
**Requirements:**· Current student or high school diploma/GED preferred
· Must be at least 16 years old
· Flexibility to work nights, weekends, holidays, opening and closing shifts
· Ability to stand for long periods of time and work in a fast-paced environment
· Ability to bend and stoop and lift 50 - 75 lbs. comfortably
· Ability to work in close quarters and around heat
· Positive attitude while conducting any and all duties
· Commitment to guest satisfaction. Looks at Restaurant operations from the Guest's point of view
· Effective communicator with Teammates and the Restaurant Management Team
· Excellent Time Management Skills Transportation & Accessibility:
· Must have reliable transportation to work
· Must have telephone or other reliable method of communicating with Restaurant Management Team and Teammates  

**About Dave's Hot Chicken:**Dave's Hot Chicken was created by best friends Dave Kopushyan, Arman Oganesyan, and Tommy and Gary Rubenyan. Dave, a chef trained in Thomas Keller's (French Laundry) organization, set out to create the perfect Hot Chicken by searching, tasting, and frying. The four friends scrounged up $900 to put a tiny stand in an East Hollywood parking lot. The menu was simple, and the chicken was the star. And what chicken it is! Sourced and prepared to be the juiciest and most tender imaginable with each piece topped with Dave's own mix of spices ranging from No Spice to ""The Reaper.""  

Arman created Instagram buzz and the lines began to grow. Two nights later, Eater/LA showed up to see what the fuss was about. The next morning's headline read ""East Hollywood's Late Night Chicken Stand Might Blow Your Mind."" Almost instantly, the lines stretched around the block. A year later, the boys had the money to open a shop in a hip strip-mall with decor by local street artists, where the crowds continued to grow with wait-times of an hour and more. From there, the incredibly craveable ""Hot and Spicy"" varieties have created a cult following with rave reviews across the U.S. and Canada","https://www.indeed.com/cmp/Dave-S-Hot-Chicken","https://daveshotchicken.ca/","","","","","https://d2q79iu7y748jz.cloudfront.net/s/_squarelogo/256x256/3a62352a6e37f834d0770b807a1d9f72","","",""
"9d2dbbdea199f32b","indeed","https://www.indeed.com/viewjob?jk=9d2dbbdea199f32b","http://traitset.com/course/postingdetail.aspx?position=2095492&id=11231492&r=i","Security Supervisor","Motivated Security Services","Somerville, NJ, US","fulltime","2024-09-01","","hourly","","","USD",False,"","","","","","Location: Trenton Public Schools


Pay: $15.00 Hourly


Shift: Monday through Friday 7AM-4PM (ALL YEAR WORK)


Requirements: Must have Valid Driver License and Own Personal Vehicle; NJ SORA license; Supervisory Experience  



**Immediate Hire!!!!**

This year, Motivated Security is celebrating 50 Years of accomplishments and a commitment to the multi-faceted security industry by providing our diverse list of customers with dependable, smart, and cost-effective security solutions. If you’re an honest, customer service oriented, hardworking, professional who always strives to do their best, we’re looking for you. We invite you to explore an opportunity with Motivated Security whether just starting your career or as an experienced security professional looking to join a rewarding team.


If you’re at least 18 years of age and have a valid Drivers' License; Social Security card, Passport, or other government ID; a High School diploma or equivalent; required NJ Guard License and reliable transportation, you can get started on a successful and rewarding career track with Motivated Security Services, Inc.


For our full-time associates, we offer medical, dental, and life insurance, 401K, PTO and holiday bonuses, family assistance programs, company and vendor discounts. Since over 70% of our promotions occur from within, you are almost assured advancement if you consistently exhibit Motivated’s core values, work hard, and help our brand grow.


Motivated also has part-time, flexible, and floating schedules available. If you’re ready to launch an illustrious career with Motivated, this is where you begin.  



**Ideal candidates must** :


Be customer service oriented.


Have the desire to interact with people positively and in support of Motivated’s core values.


Be able to obtain a State Guard License in New Jersey or New York dependent upon the state in which you work.


Have the ability to operate radio and telephone equipment, and console monitors.


Be able to read, understand, follow, and communicate standard operating procedures and instructions.


Have a flexible work schedule.


Have above average computer skills to utilize innovative technology and database platforms.


Agree to maintain our strict time and attendance standards.


Comply with Motivated’s appearance standards, and maintain a professional appearance at all times while wearing our uniform, insignia, and attire.


Be able to assess and evaluate situations effectively.


Have excellent verbal and written English communication skills.


Show active listening skills.


Demonstrate a strong attention to detail.  



**Job responsibilities include:**

Assist with the Supervision of the Security Staff for all schools in the Trenton Schools district.


Displaying courtesy, respect and exceptional customer service to our customers, employees and visitors.


Overall responsibility of managing tenant and guest access to our client properties.


Performing a variety of safety, security, customer services, public relations duties, and related functions specific to the job location.


Providing the first line of response to emergencies and carrying out the policies and procedures of our customer’s Property Management.


Observing and reporting security issues and safety concerns as required.


Responding appropriately to fire command station signals and alarms.


Controlling access to our customer’s facility through admittance processes, and screening visitors and employees.


Monitoring entrances and exits, and acting to prevent unapproved or unauthorized entry.


Preparing logs or reports and other documents as required and/or requested.


Observing and reporting incidents or suspicious activity to customer representatives, Motivated Security management, life/safety personnel or public safety authorities as appropriate for the circumstances and/or as required by our customer.


Lifting or carrying up to 40 pounds.


Working in various environments including conditions such as rain, cold, or heat


maintaining a constant level of alertness and attention while working.  



Thank you for your interest in working with Motivated Security Services, Inc. We are an equal opportunity employer and we do not discriminate. We celebrate diversity and are committed to creating a safe environment for all Motivated associates. If you have questions regarding our hiring process, or believe you were treated unfairly, please contact the Human Resources department at 908-526-1140.  



**Join Motivated Security as a Security Supervisor – Apply Today!**","https://www.indeed.com/cmp/Motivated-Security-Services","https://motivatedsecurity.com/","","501 to 1,000","$25M to $100M (USD)","","https://d2q79iu7y748jz.cloudfront.net/s/_squarelogo/256x256/a524a1c5b42b1f1c7cf8e6815e9b5d58","","",""
"52a133457e1952dc","indeed","https://www.indeed.com/viewjob?jk=52a133457e1952dc","http://traitset.com/course/postingdetail.aspx?position=2110816&id=28530816&r=i","Unarmed Roving Officer","","Norwalk, CT, US","","2024-09-01","direct_data","yearly",30000.0,33599.0,"USD",False,"","","","","","Narrow Security is looking for a professional Security Roving Officer to protect our premises, assets and personnel. You will have the opportunity to work at many different sites with a wide variety of duties. The Security Rover will maintain a high visibility presence and prevent all illegal or inappropriate actions. The goal is to detect, deter, observe and report.  



**Responsibilities:**

· Required to work for multiple clients at multiple locations, covering special projects, call offs, vacations and open shifts


· Display exceptional customer service and communication skills


· Ability to handle crisis situations at the client site, calmly and efficiently


· Monitor premises to prevent theft, violence, or infractions of rules


· Be diligent and vigilant in security and safety awareness


· Foot patrol and Fix post.


· Working at indoor and outdoor facilities


**Requirements:**

· Must have valid Drivers License


· Must own reliable transportation and have an active cell phone number


· Must have up to date Connecticut State Guard License


· Must be reliable and \\*\\*punctual\\*\\*


· Uniform attire and grooming standards must be maintained while in uniform


· Must maintain a professional demeanor and appearance


· Proven work experience as a security guard or relevant position


· Speak fluent English


· Must possess great communication skills as well as customer service skills","","","","","","","","","",""
