"id","site","job_url","job_url_direct","title","company","location","job_type","date_posted","salary_source","interval","min_amount","max_amount","currency","is_remote","job_level","job_function","company_industry","listing_type","emails","description","company_url","company_url_direct","company_addresses","company_num_employees","company_revenue","company_description","logo_photo_url","banner_photo_url","ceo_name","ceo_photo_url"
"074e54d684940374","indeed","https://www.indeed.com/viewjob?jk=074e54d684940374","http://www.indeed.com/job/paralegallegal-assistant-074e54d684940374","Paralegal/Legal Assistant","Katz Law Firm PLLC","Cedarhurst, NY, US","parttime, fulltime","2024-09-08","direct_data","hourly",22.0,30.0,"USD",False,"","","","","","Position Type: Part-time and/or Full-time

Available: Immediately

Experience required: Preferably at least 2 years 

A Nassau County law firm is looking for a paralegal with a trusts and estates background. The ideal candidate will possess solid paralegal skills (word processing, filing, administrative office skills) in addition to skills that are tailored to the needs of a trusts and estates practice. This includes:

· Drafting Skills (estate planning documents, engagement letters, summaries/flowcharts)

· Experience with Probate and Estate Administration Forms (knowing which forms to fill out, how to fill out the forms and filing them with the court)

· Research (researching topics, analysis and preparing memoranda)

· Experience with Secretary and Filing Work

Please email a resume (and a writing sample if possible).

Job Types: Full-time, Part-time

Pay: $22.00 - $30.00 per hour

Expected hours: 20 – 40 per week

Benefits:

* Flexible schedule
* Free parking
* Opportunities for advancement
* Professional development assistance
* Travel reimbursement

Schedule:

* 10 hour shift
* 4 hour shift
* 8 hour shift
* Choose your own hours
* Day shift
* Monday to Friday
* No nights

Work Location: In person","https://www.indeed.com/cmp/Katz-Law-Firm-Pllc","","","","","","","","",""
"be675e579fad3030","indeed","https://www.indeed.com/viewjob?jk=be675e579fad3030","https://careers.spglobal.com/jobs/306673?lang=en-us&utm_source=indeed","Head of Software Engineering - Self Service Platforms","S&P Global","New York, NY, US","","2024-09-08","direct_data","yearly",185500.0,300000.0,"USD",False,"","","","","EEO.Compliance@spglobal.com","**About the Role:**  

**Grade Level (for internal use):** 15
  
**Head of Software Engineering:** Self Service Platforms
  
  

**The Head of Software Engineering:** Self Service Platforms will play a pivotal role in our strategic transformation from single application development to a self service platform-centric approach. The Self Service Platform teams will architect and build the next generation of our Index creation, calculation and runtime systems. This team will build the self service tooling to allow our quants and index engineers to develop Index methodologies and launch them into production. This team will also build the run-time environment that will calculate and distribute the indexes.
  
  

As a key Leader of the Technology Organization, the Head of Software Engineering: Self Service Platforms will lead the execution of the platform strategy leveraging a portfolio of teams and programs that include software engineering, test engineers, data engineering, and software architects.
  
  

**The Head of Software Engineering:** Self Service Platforms must be a champion for change and culture, drive innovation across the organization, foster Agile principles, and create an environment that motivates and develops a bright and technically diverse engineering organization. This position is a leader of leaders, responsible for not only guiding teams but also developing talent at all levels of the organization.
  
  

**Key Responsibilities:**  

**People Management & Talent Development:**  

Lead, inspire, and manage a globally distributed, cross-functional organization, ensuring that all team members are engaged and performing at their best.
  
  

Foster a culture of continuous learning and professional growth by implementing structured upskilling programs, talent development initiatives, and succession planning.
  
  

Actively mentor and coach engineering managers, helping them grow into more effective leaders and nurturing future leadership within the organization.
  
  

Promote a strong sense of ownership, accountability, and collaboration across teams, ensuring that each team member is aligned with the overall goals and mission of the organization.
  
  

Develop strategies for identifying and nurturing high-potential employees, ensuring that the organization has the talent required to meet current and future challenges.
  
  

**Platform Strategy & Execution:**  

Oversee the Self Service Platform strategy, ensuring it empower the S&P Dow Jones Indices internal users to launch indices to market in record time.
  
  

Build GenAI capabilities into the platform to shorten the development time of index methodologies.
  
  

Partner with the internal index operations team to understand the workflows and design the platform to simplify their workflows.
  
  

Partner with the Data Platforms team to distribute index data to customer across multiple delivery methods (API, Streaming, Real-Time, FTP, Cloud Marketplaces, etc.).
  
  

**Development Management:**  

Collaborate with customer-facing peers to create and deliver on multi-year roadmaps that align with business objectives.
  
  

Manage and build high-performing teams, both on-shore and off-shore, ensuring seamless collaboration and productivity.
  
  

Drive the transformation from multiple applications and tools into unified platforms, setting and vetting the architecture direction of our systems.
  
  

Develop and implement a GenAI strategy to automate workflows.
  
  

Oversee the migration of legacy applications to forward-looking platforms, identifying and consolidating duplicate functionalities, infrastructure environments, and teams.
  
  

**Agile Responsibilities:**  

Provide ongoing coaching to agile teams, ensuring they work efficiently and meet their sprint goals.
  
  

Mentor team members, fostering an environment of continuous improvement and innovation.
  
  

Conduct effective one-on-ones with direct reports, ensuring they are working at capacity and meeting their deadlines.
  
  

Resource projects effectively, creating new teams as needed, and holding accountability for project resourcing.
  
  

**Technology Operations:**  

Ensure production operations achieve 99.99% uptime, partnering with infrastructure teams to manage AWS environments effectively.
  
  

Lead technology audit compliance efforts in line with regulatory requirements.
  
  

Stay current with modern software development technologies, guiding the team in adopting best practices and emerging tools.
  
  

**Experience:**  

Proven background in software development, with a deep technical understanding of building Big Data & Data Platforms.
  
  

Prior experience managing large and diverse teams.
  
  

Extensive experience in managing and developing talent, particularly in a leadership role that involves mentoring and coaching other leaders.
  
  

Prior experience in cloud-based software development (AWS or Azure) and partnering with Product Management in an agile SDLC.
  
  

Experience in a regulated industry with a strong understanding of compliance standards (e.g., SSAE16/SOC2/ISO).
  
  

Expertise in managing high-performing agile teams, including both on-shore and off-shore teams, with a focus on global development.
  
  

Previous architecture experience with large-scale cloud-based software.
  
  

**Technologies:**  

Broad experience with Python tooling and development.
  
  

Broad experience with database technologies like SQL, NoSQL, DeltaLake, DataLakes, Postgres, and Oracle.
  
  

Experience building containerized applications.
  
  

Proficiency in build applications hosted in AWS.
  
  

Familiarity with memory caching, Java application development, HTML, CSS, JavaScript, REST, JSON, and XML.
  
  

Experience in API Development and API Gateways.
  
  

**Qualifications:**  

Master’s degree in Technology or MBA.
  
  

Bachelor’s degree, preferably in Computer Science.
  
  

At least 12+ years of software development experience.
  
  

Experience in scaling SCRUM, preferably SAFe.
  
  

Advanced knowledge of object-oriented programming concepts and relational data modeling.
  
  

Ability to collaborate and brainstorm in a team environment.
  
  

Technical certification and AWS certification are a plus.
  
  

**Compensation/Benefits Information:** (This section is only applicable to US candidates)
  
  

S&P Global states that the anticipated base salary range for this position is $185,500 to $300,000. Final base salary for this role will be based on the individual’s geographic location, as well as experience level, skill set, training, licenses and certifications. In addition to base compensation, this role is eligible for an annual incentive plan. This role is eligible to receive additional S&P Global benefits. For more information on the benefits we provide to our employees, please click here .
  
  

About S&P Global Dow Jones Indic e s
  
At S&P Dow Jones Indices, we provide iconic and innovative index solutions backed by unparalleled expertise across the asset-class spectrum. By bringing transparency to the global capital markets, we empower investors everywhere to make decisions with conviction. We’re the largest global resource for index-based concepts, data and research, and home to iconic financial market indicators, such as the S&P 500 ® and the Dow Jones Industrial Average ® . More assets are invested in products based upon our indices than any other index provider in the world. With over USD 7.4 trillion in passively managed assets linked to our indices and over USD 11.3 trillion benchmarked to our indices, our solutions are widely considered indispensable in tracking market performance, evaluating portfolios and developing investment strategies.
  
**S&P Dow Jones Indices is a division of S&P Global (NYSE:** SPGI). S&P Global is the world’s foremost provider of credit ratings, benchmarks, analytics and workflow solutions in the global capital, commodity and automotive markets. With every one of our offerings, we help many of the world’s leading organizations navigate the economic landscape so they can plan for tomorrow, today. For more information, visit www.spglobal.com/spdji .
  
  

What’s In It For You?
  
  

**Our Purpose:**  

Progress is not a self-starter. It requires a catalyst to be set in motion. Information, imagination, people, technology–the right combination can unlock possibility and change the world.
  
  

Our world is in transition and getting more complex by the day. We push past expected observations and seek out new levels of understanding so that we can help companies, governments and individuals make an impact on tomorrow. At S&P Global we transform data into Essential Intelligence®, pinpointing risks and opening possibilities. We Accelerate Progress.
  
  

**Our People:**  

We're more than 35,000 strong worldwide—so we're able to understand nuances while having a broad perspective. Our team is driven by curiosity and a shared belief that Essential Intelligence can help build a more prosperous future for us all.
  
  

From finding new ways to measure sustainability to analyzing energy transition across the supply chain to building workflow solutions that make it easy to tap into insight and apply it. We are changing the way people see things and empowering them to make an impact on the world we live in. We’re committed to a more equitable future and to helping our customers find new, sustainable ways of doing business. We’re constantly seeking new solutions that have progress in mind. Join us and help create the critical insights that truly make a difference.
  
  

**Our Values:**  

Integrity, Discovery, Partnership
  
  

At S&P Global, we focus on Powering Global Markets. Throughout our history, the world's leading organizations have relied on us for the Essential Intelligence they need to make confident decisions about the road ahead. We start with a foundation of integrity in all we do, bring a spirit of discovery to our work, and collaborate in close partnership with each other and our customers to achieve shared goals.
  
  

**Benefits:**  

We take care of you, so you can take care of business. We care about our people. That’s why we provide everything you—and your career—need to thrive at S&P Global.
  
  

**Our benefits include:**  

**Health & Wellness:** Health care coverage designed for the mind and body.
  
  

**Flexible Downtime:** Generous time off helps keep you energized for your time on.
  
  

**Continuous Learning:** Access a wealth of resources to grow your career and learn valuable new skills.
  
  

**Invest in Your Future:** Secure your financial future through competitive pay, retirement planning, a continuing education program with a company-matched student loan contribution, and financial wellness programs.
  
  

**Family Friendly Perks:** It’s not just about you. S&P Global has perks for your partners and little ones, too, with some best-in class benefits for families.
  
  

**Beyond the Basics:** From retail discounts to referral incentive awards—small perks can make a big difference.
  
**For more information on benefits by country visit:** https://spgbenefits.com/benefit-summaries
  
  

**Diversity, Equity, and Inclusion at S&P Global:**  

At S&P Global, we believe diversity fuels creative insights, equity unlocks opportunity, and inclusion drives growth and innovation – Powering Global Markets. Our commitment centers on our global workforce, ensuring that our people are empowered to bring their whole selves to work. It doesn’t stop there, we strive to better reflect and serve the communities in which we live and work, and advocate for greater opportunity for all.
  
  

-----------------------------------------------------------
  
  

Equal Opportunity Employer
  
S&P Global is an equal opportunity employer and all qualified candidates will receive consideration for employment without regard to race/ethnicity, color, religion, sex, sexual orientation, gender identity, national origin, age, disability, marital status, military veteran status, unemployment status, or any other status protected by law. Only electronic job submissions will be considered for employment.
  
  

If you need an accommodation during the application process due to a disability, please send an email to: EEO.Compliance@spglobal.com and your request will be forwarded to the appropriate person.
  
  

**US Candidates Only:** The EEO is the Law Poster http://www.dol.gov/ofccp/regs/compliance/posters/pdf/eeopost.pdf describes discrimination protections under federal law.
  
  

----------------------------------------------------------- 10 - Officials or Managers (EEO-2 Job Categories-United States of America), IFTECH102 - Senior Management (EEO Job Group), SWP Priority – Ratings - (Strategic Workforce Planning)
  
  

**Job ID:** 306673
  
**Posted On:** 2024-09-08
  
**Location:** New York, New York, United States","https://www.indeed.com/cmp/S&P-Global","https://www.spglobal.com/en/","New York, NY","10,000+","more than $10B (USD)","We deliver Essential Intelligence that powers decision making. S&P Global provides the world’s leading organizations with the right data, connected technologies and expertise they need to move ahead.","https://d2q79iu7y748jz.cloudfront.net/s/_squarelogo/256x256/2170f3147bf853b5292d0c54d3e75479","https://d2q79iu7y748jz.cloudfront.net/s/_headerimage/1960x400/1377e20074dc9a1c3465961e1c0425fe","Douglas L. Peterson","https://d2q79iu7y748jz.cloudfront.net/s/_ceophoto/512x512/37dbfe9287e55ca2c78b4aa97c7e472f"
